<?xml version="1.0" encoding="UTF-8"?>
<pattern xmlns:xsi="http://www.w3.org/2001/XMLSchema-instance"
	xsi:noNamespaceSchemaLocation="../xml_schemas/Pattern_schema.xsd"
	alloy="ADD.als">
	<window id="initial" card="one" alloy="Initial">
		<title>.*</title>
		<modal>any</modal>
		<root>any</root>
		<action_widget id="paw1" card="one" alloy="Trigger">
			<label>.*</label>
		</action_widget>
		<selectable_widget id="psw1" card="one" alloy="List">
			<label>.*</label>
			<size>.*</size>
		</selectable_widget>
	</window>
	<window id="form_1" card="one" alloy="Form">
		<title>.*</title>
		<modal>any</modal>
		<root>any</root>
		<action_widget id="paw2" card="one" alloy="Ok">
			<label>.*</label>
		</action_widget>
		<action_widget id="paw3" card="one" alloy="Cancel">
			<label>.*</label>
		</action_widget>
		<input_widget id="piw1" card="some" alloy="Input">
			<label>.*</label>
			<text>.*</text>
		</input_widget>
	</window>
	<window id="form_2" card="set" alloy="Form">
		<title>.*</title>
		<modal>any</modal>
		<root>any</root>
		<action_widget id="paw4" card="one" alloy="Ok">
			<label>.*</label>
		</action_widget>
		<action_widget id="paw5" card="one" alloy="Cancel">
			<label>.*</label>
		</action_widget>
		<input_widget id="piw2" card="some" alloy="Input">
			<label>.*</label>
			<text>.*</text>
		</input_widget>
	</window>
	<window id="confirmation" card="lone" alloy="Confirm">
		<title>.*</title>
		<modal>true</modal>
		<root>any</root>
		<action_widget id="paw6" card="one" alloy="Ok">
			<label>.*</label>
		</action_widget>
		<action_widget id="paw7" card="one" alloy="Cancel">
			<label>.*</label>
		</action_widget>
		<input_widget id="piw2" card="none" alloy="">
			<label>.*</label>
			<text>.*</text>
		</input_widget>
	</window>
	<edge type="static">
		<from>paw1</from>
		<to>form_1</to>
	</edge>
	<edge type="static">
		<from>paw3</from>
		<to>initial</to>
	</edge>
	<edge type="dynamic">
		<from>paw2</from>
		<to>form_2</to>
		<to>confirmation</to>
	</edge>
	<edge type="dynamic">
		<from>paw4</from>
		<to>form_2</to>
		<to>confirmation</to>
	</edge>
	<edge type="static">
		<from>paw5</from>
		<to>form_2</to>
		<to>form_1</to>
	</edge>
	<edge type="static">
		<from>paw7</from>
		<to>form_2</to>
		<to>form_1</to>
	</edge>
</pattern>
